id,title,abstract
1,Patch-based medical image segmentation using Quantum Tensor Networks,"Tensor networks are efficient factorisations of high dimensional tensors into
a network of lower order tensors. They have been most commonly used to model
entanglement in quantum many-body systems and more recently are witnessing
increased applications in supervised machine learning. In this work, we
formulate image segmentation in a supervised setting with tensor networks. The
key idea is to first lift the pixels in image patches to exponentially high
dimensional feature spaces and using a linear decision hyper-plane to classify
the input pixels into foreground and background classes. The high dimensional
linear model itself is approximated using the matrix product state (MPS) tensor
network. The MPS is weight-shared between the non-overlapping image patches
resulting in our strided tensor network model. The performance of the proposed
model is evaluated on three 2D- and one 3D- biomedical imaging datasets. The
performance of the proposed tensor network segmentation model is compared with
relevant baseline methods. In the 2D experiments, the tensor network model
yeilds competitive performance compared to the baseline methods while being
more resource efficient."
2,Segmenting two-dimensional structures with strided tensor networks,"Tensor networks provide an efficient approximation of operations involving
high dimensional tensors and have been extensively used in modelling quantum
many-body systems. More recently, supervised learning has been attempted with
tensor networks, primarily focused on tasks such as image classification. In
this work, we propose a novel formulation of tensor networks for supervised
image segmentation which allows them to operate on high resolution medical
images. We use the matrix product state (MPS) tensor network on non-overlapping
patches of a given input image to predict the segmentation mask by learning a
pixel-wise linear classification rule in a high dimensional space. The proposed
model is end-to-end trainable using backpropagation. It is implemented as a
Strided Tensor Network to reduce the parameter complexity. The performance of
the proposed method is evaluated on two public medical imaging datasets and
compared to relevant baselines. The evaluation shows that the strided tensor
network yields competitive performance compared to CNN-based models while using
fewer resources. Additionally, based on the experiments we discuss the
feasibility of using fully linear models for segmentation tasks."
3,3D Quantum Cuts for Automatic Segmentation of Porous Media in Tomography Images,"Binary segmentation of volumetric images of porous media is a crucial step
towards gaining a deeper understanding of the factors governing biogeochemical
processes at minute scales. Contemporary work primarily revolves around
primitive techniques based on global or local adaptive thresholding that have
known common drawbacks in image segmentation. Moreover, absence of a unified
benchmark prohibits quantitative evaluation, which further clouds the impact of
existing methodologies. In this study, we tackle the issue on both fronts.
Firstly, by drawing parallels with natural image segmentation, we propose a
novel, and automatic segmentation technique, 3D Quantum Cuts (QCuts-3D)
grounded on a state-of-the-art spectral clustering technique. Secondly, we
curate and present a publicly available dataset of 68 multiphase volumetric
images of porous media with diverse solid geometries, along with voxel-wise
ground truth annotations for each constituting phase. We provide comparative
evaluations between QCuts-3D and the current state-of-the-art over this dataset
across a variety of evaluation metrics. The proposed systematic approach
achieves a 26% increase in AUROC while achieving a substantial reduction of the
computational complexity of the state-of-the-art competitors. Moreover,
statistical analysis reveals that the proposed method exhibits significant
robustness against the compositional variations of porous media."
4,Graph Cut Segmentation Methods Revisited with a Quantum Algorithm,"The design and performance of computer vision algorithms are greatly
influenced by the hardware on which they are implemented. CPUs, multi-core
CPUs, FPGAs and GPUs have inspired new algorithms and enabled existing ideas to
be realized. This is notably the case with GPUs, which has significantly
changed the landscape of computer vision research through deep learning. As the
end of Moores law approaches, researchers and hardware manufacturers are
exploring alternative hardware computing paradigms. Quantum computers are a
very promising alternative and offer polynomial or even exponential speed-ups
over conventional computing for some problems. This paper presents a novel
approach to image segmentation that uses new quantum computing hardware.
Segmentation is formulated as a graph cut problem that can be mapped to the
quantum approximate optimization algorithm (QAOA). This algorithm can be
implemented on current and near-term quantum computers. Encouraging results are
presented on artificial and medical imaging data. This represents an important,
practical step towards leveraging quantum computers for computer vision."
5,Quantum Edge Detection for Image Segmentation in Optical Environments,"A quantum edge detector for image segmentation in optical environments is
presented in this work. A Boolean version of the same detector is presented
too. The quantum version of the new edge detector works with computational
basis states, exclusively. This way, we can easily avoid the problem of quantum
measurement retrieving the result of applying the new detector on the image.
Besides, a new criterion and logic based on projections onto vertical axis of
Bloch's Sphere exclusively are presented too. This approach will allow us: 1) a
simpler development of logic quantum operations, where they will closer to
those used in the classical logic operations, 2) building simple and robust
classical-to-quantum and quantum-to-classical interfaces. Said so far is
extended to quantum algorithms outside image processing too. In a special
section on metric and simulations, a new metric based on the comparison between
the classical and quantum versions algorithms for edge detection of images is
presented. Notable differences between the results of classical and quantum
versions of such algorithms (outside and inside of quantum computer,
respectively) show the existence of implementation problems involved in the
experiment, and that they have not been properly modeled for optical
environments. However, although they are different, the quantum results are
equally valid. The latter is clearly seen in the computer simulations"
6,Conjugate Variables as a Resource in Signal and Image Processing,"In this paper we develop a new technique to model joint distributions of
signals. Our technique is based on quantum mechanical conjugate variables. We
show that the transition probability of quantum states leads to a distance
function on the signals. This distance function obeys the triangle inequality
on all quantum states and becomes a metric on pure quantum states. Treating
signals as conjugate variables allows us to create a new approach to segment
them.
  Keywords: Quantum information, transition probability, Euclidean distance,
Fubini-study metric, Bhattacharyya coefficients, conjugate variable,
signal/sensor fusion, signal and image segmentation."
7,Information Obfuscation of Graph Neural Networks,"While the advent of Graph Neural Networks (GNNs) has greatly improved node
and graph representation learning in many applications, the neighborhood
aggregation scheme exposes additional vulnerabilities to adversaries seeking to
extract node-level information about sensitive attributes. In this paper, we
study the problem of protecting sensitive attributes by information obfuscation
when learning with graph structured data. We propose a framework to locally
filter out pre-determined sensitive attributes via adversarial training with
the total variation and the Wasserstein distance. Our method creates a strong
defense against inference attacks, while only suffering small loss in task
performance. Theoretically, we analyze the effectiveness of our framework
against a worst-case adversary, and characterize an inherent trade-off between
maximizing predictive accuracy and minimizing information leakage. Experiments
across multiple datasets from recommender systems, knowledge graphs and quantum
chemistry demonstrate that the proposed approach provides a robust defense
across various graph structures and tasks, while producing competitive GNN
encoders for downstream tasks."
8,Negational Symmetry of Quantum Neural Networks for Binary Pattern Classification,"Entanglement is a physical phenomenon, which has fueled recent successes of
quantum algorithms. Although quantum neural networks (QNNs) have shown
promising results in solving simple machine learning tasks recently, for the
time being, the effect of entanglement in QNNs and the behavior of QNNs in
binary pattern classification are still underexplored. In this work, we provide
some theoretical insight into the properties of QNNs by presenting and
analyzing a new form of invariance embedded in QNNs for both quantum binary
classification and quantum representation learning, which we term negational
symmetry. Given a quantum binary signal and its negational counterpart where a
bitwise NOT operation is applied to each quantum bit of the binary signal, a
QNN outputs the same logits. That is to say, QNNs cannot differentiate a
quantum binary signal and its negational counterpart in a binary classification
task. We further empirically evaluate the negational symmetry of QNNs in binary
pattern classification tasks using Google's quantum computing framework. The
theoretical and experimental results suggest that negational symmetry is a
fundamental property of QNNs, which is not shared by classical models. Our
findings also imply that negational symmetry is a double-edged sword in
practical quantum applications."
9,Spectral Inference Networks: Unifying Deep and Spectral Learning,"We present Spectral Inference Networks, a framework for learning
eigenfunctions of linear operators by stochastic optimization. Spectral
Inference Networks generalize Slow Feature Analysis to generic symmetric
operators, and are closely related to Variational Monte Carlo methods from
computational physics. As such, they can be a powerful tool for unsupervised
representation learning from video or graph-structured data. We cast training
Spectral Inference Networks as a bilevel optimization problem, which allows for
online learning of multiple eigenfunctions. We show results of training
Spectral Inference Networks on problems in quantum mechanics and feature
learning for videos on synthetic datasets. Our results demonstrate that
Spectral Inference Networks accurately recover eigenfunctions of linear
operators and can discover interpretable representations from video in a fully
unsupervised manner."
10,Quantum-soft QUBO Suppression for Accurate Object Detection,"Non-maximum suppression (NMS) has been adopted by default for removing
redundant object detections for decades. It eliminates false positives by only
keeping the image M with highest detection score and images whose overlap ratio
with M is less than a predefined threshold. However, this greedy algorithm may
not work well for object detection under occlusion scenario where true
positives with lower detection scores are possibly suppressed. In this paper,
we first map the task of removing redundant detections into Quadratic
Unconstrained Binary Optimization (QUBO) framework that consists of detection
score from each bounding box and overlap ratio between pair of bounding boxes.
Next, we solve the QUBO problem using the proposed Quantum-soft QUBO
Suppression (QSQS) algorithm for fast and accurate detection by exploiting
quantum computing advantages. Experiments indicate that QSQS improves mean
average precision from 74.20% to 75.11% for PASCAL VOC 2007. It consistently
outperforms NMS and soft-NMS for Reasonable subset of benchmark pedestrian
detection CityPersons."
11,Object Tracking based on Quantum Particle Swarm Optimization,"In Computer Vision domain, moving Object Tracking considered as one of the
toughest problem.As there so many factors associated like illumination of
light, noise, occlusion, sudden start and stop of moving object, shading which
makes tracking even harder problem not only for dynamic background but also for
static background.In this paper we present a new object tracking algorithm
based on Dominant points on tracked object using Quantum particle swarm
optimization (QPSO) which is a new different version of PSO based on Quantum
theory. The novelty in our approach is that it can be successfully applicable
in variable background as well as static background and application of quantum
PSO makes the algorithm runs lot faster where other basic PSO algorithm failed
to do so due to heavy computation.In our approach firstly dominants points of
tracked objects detected, then a group of particles form a swarm are
initialized randomly over the image search space and then start searching the
curvature connected between two consecutive dominant points until they satisfy
fitness criteria. Obviously it is a Multi-Swarm approach as there are multiple
dominant points, as they moves, the curvature moves and the curvature movement
is tracked by the swarm throughout the video and eventually when the swarm
reaches optimal solution , a bounding box drawn based on particles final
position.Experimental results demonstrate this proposed QPSO based method work
efficiently and effectively in visual object tracking in both dynamic and
static environments and run time shows that it runs closely 90% faster than
basic PSO.in our approach we also apply parallelism using MatLab Parfor command
to show how very less number of iteration and swarm size will enable us to
successfully track object."
12,Simultaneously Evolving Deep Reinforcement Learning Models using Multifactorial Optimization,"In recent years, Multifactorial Optimization (MFO) has gained a notable
momentum in the research community. MFO is known for its inherent capability to
efficiently address multiple optimization tasks at the same time, while
transferring information among such tasks to improve their convergence speed.
On the other hand, the quantum leap made by Deep Q Learning (DQL) in the
Machine Learning field has allowed facing Reinforcement Learning (RL) problems
of unprecedented complexity. Unfortunately, complex DQL models usually find it
difficult to converge to optimal policies due to the lack of exploration or
sparse rewards. In order to overcome these drawbacks, pre-trained models are
widely harnessed via Transfer Learning, extrapolating knowledge acquired in a
source task to the target task. Besides, meta-heuristic optimization has been
shown to reduce the lack of exploration of DQL models. This work proposes a MFO
framework capable of simultaneously evolving several DQL models towards solving
interrelated RL tasks. Specifically, our proposed framework blends together the
benefits of meta-heuristic optimization, Transfer Learning and DQL to automate
the process of knowledge transfer and policy learning of distributed RL agents.
A thorough experimentation is presented and discussed so as to assess the
performance of the framework, its comparison to the traditional methodology for
Transfer Learning in terms of convergence, speed and policy quality , and the
intertask relationships found and exploited over the search process."
13,Reinforcement Learning Enhanced Quantum-inspired Algorithm for Combinatorial Optimization,"Quantum hardware and quantum-inspired algorithms are becoming increasingly
popular for combinatorial optimization. However, these algorithms may require
careful hyperparameter tuning for each problem instance. We use a reinforcement
learning agent in conjunction with a quantum-inspired algorithm to solve the
Ising energy minimization problem, which is equivalent to the Maximum Cut
problem. The agent controls the algorithm by tuning one of its parameters with
the goal of improving recently seen solutions. We propose a new Rescaled Ranked
Reward (R3) method that enables stable single-player version of self-play
training that helps the agent to escape local optima. The training on any
problem instance can be accelerated by applying transfer learning from an agent
trained on randomly generated problems. Our approach allows sampling
high-quality solutions to the Ising problem with high probability and
outperforms both baseline heuristics and a black-box hyperparameter
optimization approach."
14,Quantum-Classical Hybrid Machine Learning for Image Classification (ICCAD Special Session Paper),"Image classification is a major application domain for conventional deep
learning (DL). Quantum machine learning (QML) has the potential to
revolutionize image classification. In any typical DL-based image
classification, we use convolutional neural network (CNN) to extract features
from the image and multi-layer perceptron network (MLP) to create the actual
decision boundaries. On one hand, QML models can be useful in both of these
tasks. Convolution with parameterized quantum circuits (Quanvolution) can
extract rich features from the images. On the other hand, quantum neural
network (QNN) models can create complex decision boundaries. Therefore,
Quanvolution and QNN can be used to create an end-to-end QML model for image
classification. Alternatively, we can extract image features separately using
classical dimension reduction techniques such as, Principal Components Analysis
(PCA) or Convolutional Autoencoder (CAE) and use the extracted features to
train a QNN. We review two proposals on quantum-classical hybrid ML models for
image classification namely, Quanvolutional Neural Network and dimension
reduction using a classical algorithm followed by QNN. Particularly, we make a
case for trainable filters in Quanvolution and CAE-based feature extraction for
image datasets (instead of dimension reduction using linear transformations
such as, PCA). We discuss various design choices, potential opportunities, and
drawbacks of these models. We also release a Python-based framework to create
and explore these hybrid models with a variety of design choices."
15,Rotationally Equivariant Neural Operators for Learning Transformations on Tensor Fields (eg 3D Images and Vector Fields),"We introduce equivariant neural operators for learning resolution invariant
as well as translation and rotation equivariant transformations between sets of
tensor fields. Input and output may contain arbitrary mixes of scalar fields,
vector fields, second order tensor fields and higher order fields. Our tensor
field convolution layers emulate any linear operator by learning its impulse
response or Green's function as the convolution kernel. Our tensor field
attention layers emulate pairwise field coupling via local tensor products.
Convolutions and associated adjoints can be in real or Fourier space allowing
for linear scaling. By unifying concepts from E3NN, TBNN and FNO, we achieve
good predictive performance on a wide range of PDEs and dynamical systems in
engineering and quantum chemistry. Code is in Julia and available upon request
from authors."
16,Geometry-aware Transformer for molecular property prediction,"Recently, graph neural networks (GNNs) have achieved remarkable performances
for quantum mechanical problems. However, a graph convolution can only cover a
localized region, and cannot capture long-range interactions of atoms. This
behavior is contrary to theoretical interatomic potentials, which is a
fundamental limitation of the spatial based GNNs. In this work, we propose a
novel attention-based framework for molecular property prediction tasks. We
represent a molecular conformation as a discrete atomic sequence combined by
atom-atom distance attributes, named Geometry-aware Transformer (GeoT). In
particular, we adopt a Transformer architecture, which has been widely used for
sequential data. Our proposed model trains sequential representations of
molecular graphs based on globally constructed attentions, maintaining all
spatial arrangements of atom pairs. Our method does not suffer from cost
intensive computations, such as angle calculations. The experimental results on
several public benchmarks and visualization maps verified that keeping the
long-range interatomic attributes can significantly improve the model
predictability."
17,Matching Point Sets with Quantum Circuit Learning,"In this work, we propose a parameterised quantum circuit learning approach to
point set matching problem. In contrast to previous annealing-based methods, we
propose a quantum circuit-based framework whose parameters are optimised via
descending the gradients w.r.t a kernel-based loss function. We formulate the
shape matching problem into a distribution learning task; that is, to learn the
distribution of the optimal transformation parameters. We show that this
framework is able to find multiple optimal solutions for symmetric shapes and
is more accurate, scalable and robust than the previous annealing-based method.
Code, data and pre-trained weights are available at the project page:
\href{https://hansen7.github.io/qKC}{https://hansen7.github.io/qKC}"
18,Do Large Scale Molecular Language Representations Capture Important Structural Information?,"Predicting chemical properties from the structure of a molecule is of great
importance in many applications including drug discovery and material design.
Machine learning based molecular property prediction holds the promise of
enabling accurate predictions at much less complexity, when compared to, for
example Density Functional Theory (DFT) calculations. Features extracted from
molecular graphs, using graph neural nets in a supervised manner, have emerged
as strong baselines for such tasks. However, the vast chemical space together
with the limited availability of labels makes supervised learning challenging,
calling for learning a general-purpose molecular representation. Recently,
pre-trained transformer-based language models (PTLMs) on large unlabeled corpus
have produced state-of-the-art results in many downstream natural language
processing tasks. Inspired by this development, here we present molecular
embeddings obtained by training an efficient transformer encoder model,
referred to as MoLFormer. This model was employed with a linear attention
mechanism and highly paralleized training on 1D SMILES sequences of 1.1 billion
unlabeled molecules from the PubChem and ZINC datasets. Experiments show that
the learned molecular representation performs competitively, when compared to
existing graph-based and fingerprint-based supervised learning baselines, on
the challenging tasks of predicting properties of QM8 and QM9 molecules.
Further task-specific fine-tuning of the MoLFormerr representation improves
performance on several of those property prediction benchmarks. These results
provide encouraging evidence that large-scale molecular language models can
capture sufficient structural information to be able to accurately predict
quantum chemical properties and beyond."
19,A hybrid quantum-classical neural network with deep residual learning,"Inspired by the success of classical neural networks, there has been
tremendous effort to develop classical effective neural networks into quantum
concept. In this paper, a novel hybrid quantum-classical neural network with
deep residual learning (Res-HQCNN) is proposed. We firstly analysis how to
connect residual block structure with a quantum neural network, and give the
corresponding training algorithm. At the same time, the advantages and
disadvantages of transforming deep residual learning into quantum concept are
provided. As a result, the model can be trained in an end-to-end fashion,
analogue to the backpropagation in classical neural networks.
  To explore the effectiveness of Res-HQCNN , we perform extensive experiments
for quantum data with or without noisy on classical computer. The experimental
results show the Res-HQCNN performs better to learn an unknown unitary
transformation and has stronger robustness for noisy data, when compared to
state of the arts. Moreover, the possible methods of combining residual
learning with quantum neural networks are also discussed."
20,BoXHED 2.0: Scalable boosting of functional data in survival analysis,"Modern applications of survival analysis increasingly involve time-dependent
covariates, which constitute a form of functional data. Learning from
functional data generally involves repeated evaluations of time integrals which
is numerically expensive. In this work we propose a lightweight data
preprocessing step that transforms functional data into nonfunctional data.
Boosting implementations for nonfunctional data can then be used, whereby the
required numerical integration comes for free as part of the training phase. We
use this to develop BoXHED 2.0, a quantum leap over the tree-boosted hazard
package BoXHED 1.0. BoXHED 2.0 extends BoXHED 1.0 to Aalen's multiplicative
intensity model, which covers censoring schemes far beyond right-censoring and
also supports recurrent events data. It is also massively scalable because of
preprocessing and also because it borrows from the core components of XGBoost.
BoXHED 2.0 supports the use of GPUs and multicore CPUs, and is available from
GitHub: www.github.com/BoXHED."
