id,title,abstract
40,Quantum Edge Detection for Image Segmentation in Optical Environments,"A quantum edge detector for image segmentation in optical environments is
presented in this work. A Boolean version of the same detector is presented
too. The quantum version of the new edge detector works with computational
basis states, exclusively. This way, we can easily avoid the problem of quantum
measurement retrieving the result of applying the new detector on the image.
Besides, a new criterion and logic based on projections onto vertical axis of
Bloch's Sphere exclusively are presented too. This approach will allow us: 1) a
simpler development of logic quantum operations, where they will closer to
those used in the classical logic operations, 2) building simple and robust
classical-to-quantum and quantum-to-classical interfaces. Said so far is
extended to quantum algorithms outside image processing too. In a special
section on metric and simulations, a new metric based on the comparison between
the classical and quantum versions algorithms for edge detection of images is
presented. Notable differences between the results of classical and quantum
versions of such algorithms (outside and inside of quantum computer,
respectively) show the existence of implementation problems involved in the
experiment, and that they have not been properly modeled for optical
environments. However, although they are different, the quantum results are
equally valid. The latter is clearly seen in the computer simulations"
41,Conjugate Variables as a Resource in Signal and Image Processing,"In this paper we develop a new technique to model joint distributions of
signals. Our technique is based on quantum mechanical conjugate variables. We
show that the transition probability of quantum states leads to a distance
function on the signals. This distance function obeys the triangle inequality
on all quantum states and becomes a metric on pure quantum states. Treating
signals as conjugate variables allows us to create a new approach to segment
them.
  Keywords: Quantum information, transition probability, Euclidean distance,
Fubini-study metric, Bhattacharyya coefficients, conjugate variable,
signal/sensor fusion, signal and image segmentation."
42,Do Large Scale Molecular Language Representations Capture Important Structural Information?,"Predicting chemical properties from the structure of a molecule is of great
importance in many applications including drug discovery and material design.
Machine learning based molecular property prediction holds the promise of
enabling accurate predictions at much less complexity, when compared to, for
example Density Functional Theory (DFT) calculations. Features extracted from
molecular graphs, using graph neural nets in a supervised manner, have emerged
as strong baselines for such tasks. However, the vast chemical space together
with the limited availability of labels makes supervised learning challenging,
calling for learning a general-purpose molecular representation. Recently,
pre-trained transformer-based language models (PTLMs) on large unlabeled corpus
have produced state-of-the-art results in many downstream natural language
processing tasks. Inspired by this development, here we present molecular
embeddings obtained by training an efficient transformer encoder model,
referred to as MoLFormer. This model was employed with a linear attention
mechanism and highly paralleized training on 1D SMILES sequences of 1.1 billion
unlabeled molecules from the PubChem and ZINC datasets. Experiments show that
the learned molecular representation performs competitively, when compared to
existing graph-based and fingerprint-based supervised learning baselines, on
the challenging tasks of predicting properties of QM8 and QM9 molecules.
Further task-specific fine-tuning of the MoLFormerr representation improves
performance on several of those property prediction benchmarks. These results
provide encouraging evidence that large-scale molecular language models can
capture sufficient structural information to be able to accurately predict
quantum chemical properties and beyond."
43,word2ket: Space-efficient Word Embeddings inspired by Quantum Entanglement,"Deep learning natural language processing models often use vector word
embeddings, such as word2vec or GloVe, to represent words. A discrete sequence
of words can be much more easily integrated with downstream neural layers if it
is represented as a sequence of continuous vectors. Also, semantic
relationships between words, learned from a text corpus, can be encoded in the
relative configurations of the embedding vectors. However, storing and
accessing embedding vectors for all words in a dictionary requires large amount
of space, and may stain systems with limited GPU memory. Here, we used
approaches inspired by quantum computing to propose two related methods, {\em
word2ket} and {\em word2ketXS}, for storing word embedding matrix during
training and inference in a highly efficient way. Our approach achieves a
hundred-fold or more reduction in the space required to store the embeddings
with almost no relative drop in accuracy in practical natural language
processing tasks."
44,Heterogeneous relational message passing networks for molecular dynamics simulations,"With many frameworks based on message passing neural networks proposed to
predict molecular and bulk properties, machine learning methods have
tremendously shifted the paradigms of computational sciences underpinning
physics, material science, chemistry, and biology. While existing machine
learning models have yielded superior performances in many occasions, most of
them model and process molecular systems in terms of homogeneous graph, which
severely limits the expressive power for representing diverse interactions. In
practice, graph data with multiple node and edge types is ubiquitous and more
appropriate for molecular systems. Thus, we propose the heterogeneous
relational message passing network (HermNet), an end-to-end heterogeneous graph
neural networks, to efficiently express multiple interactions in a single model
with {\it ab initio} accuracy. HermNet performs impressively against many
top-performing models on both molecular and extended systems. Specifically,
HermNet outperforms other tested models in nearly 75\%, 83\% and 94\% of tasks
on MD17, QM9 and extended systems datasets, respectively. Finally, we elucidate
how the design of HermNet is compatible with quantum mechanics from the
perspective of the density functional theory. Besides, HermNet is a universal
framework, whose sub-networks could be replaced by other advanced models."
45,Model Uncertainty and Correctability for Directed Graphical Models,"Probabilistic graphical models are a fundamental tool in probabilistic
modeling, machine learning and artificial intelligence. They allow us to
integrate in a natural way expert knowledge, physical modeling, heterogeneous
and correlated data and quantities of interest. For exactly this reason,
multiple sources of model uncertainty are inherent within the modular structure
of the graphical model. In this paper we develop information-theoretic, robust
uncertainty quantification methods and non-parametric stress tests for directed
graphical models to assess the effect and the propagation through the graph of
multi-sourced model uncertainties to quantities of interest. These methods
allow us to rank the different sources of uncertainty and correct the graphical
model by targeting its most impactful components with respect to the quantities
of interest. Thus, from a machine learning perspective, we provide a
mathematically rigorous approach to correctability that guarantees a systematic
selection for improvement of components of a graphical model while controlling
potential new errors created in the process in other parts of the model. We
demonstrate our methods in two physico-chemical examples, namely quantum
scale-informed chemical kinetics and materials screening to improve the
efficiency of fuel cells."
46,Adiabatic Quantum Graph Matching with Permutation Matrix Constraints,"Matching problems on 3D shapes and images are challenging as they are
frequently formulated as combinatorial quadratic assignment problems (QAPs)
with permutation matrix constraints, which are NP-hard. In this work, we
address such problems with emerging quantum computing technology and propose
several reformulations of QAPs as unconstrained problems suitable for efficient
execution on quantum hardware. We investigate several ways to inject
permutation matrix constraints in a quadratic unconstrained binary optimization
problem which can be mapped to quantum hardware. We focus on obtaining a
sufficient spectral gap, which further increases the probability to measure
optimal solutions and valid permutation matrices in a single run. We perform
our experiments on the quantum computer D-Wave 2000Q (2^11 qubits, adiabatic).
Despite the observed discrepancy between simulated adiabatic quantum computing
and execution on real quantum hardware, our reformulation of permutation matrix
constraints increases the robustness of the numerical computations over other
penalty approaches in our experiments. The proposed algorithm has the potential
to scale to higher dimensions on future quantum computing architectures, which
opens up multiple new directions for solving matching problems in 3D computer
vision and graphics."
47,Geometry-aware Transformer for molecular property prediction,"Recently, graph neural networks (GNNs) have achieved remarkable performances
for quantum mechanical problems. However, a graph convolution can only cover a
localized region, and cannot capture long-range interactions of atoms. This
behavior is contrary to theoretical interatomic potentials, which is a
fundamental limitation of the spatial based GNNs. In this work, we propose a
novel attention-based framework for molecular property prediction tasks. We
represent a molecular conformation as a discrete atomic sequence combined by
atom-atom distance attributes, named Geometry-aware Transformer (GeoT). In
particular, we adopt a Transformer architecture, which has been widely used for
sequential data. Our proposed model trains sequential representations of
molecular graphs based on globally constructed attentions, maintaining all
spatial arrangements of atom pairs. Our method does not suffer from cost
intensive computations, such as angle calculations. The experimental results on
several public benchmarks and visualization maps verified that keeping the
long-range interatomic attributes can significantly improve the model
predictability."
48,Do Large Scale Molecular Language Representations Capture Important Structural Information?,"Predicting chemical properties from the structure of a molecule is of great
importance in many applications including drug discovery and material design.
Machine learning based molecular property prediction holds the promise of
enabling accurate predictions at much less complexity, when compared to, for
example Density Functional Theory (DFT) calculations. Features extracted from
molecular graphs, using graph neural nets in a supervised manner, have emerged
as strong baselines for such tasks. However, the vast chemical space together
with the limited availability of labels makes supervised learning challenging,
calling for learning a general-purpose molecular representation. Recently,
pre-trained transformer-based language models (PTLMs) on large unlabeled corpus
have produced state-of-the-art results in many downstream natural language
processing tasks. Inspired by this development, here we present molecular
embeddings obtained by training an efficient transformer encoder model,
referred to as MoLFormer. This model was employed with a linear attention
mechanism and highly paralleized training on 1D SMILES sequences of 1.1 billion
unlabeled molecules from the PubChem and ZINC datasets. Experiments show that
the learned molecular representation performs competitively, when compared to
existing graph-based and fingerprint-based supervised learning baselines, on
the challenging tasks of predicting properties of QM8 and QM9 molecules.
Further task-specific fine-tuning of the MoLFormerr representation improves
performance on several of those property prediction benchmarks. These results
provide encouraging evidence that large-scale molecular language models can
capture sufficient structural information to be able to accurately predict
quantum chemical properties and beyond."
49,Fast Quantum Property Prediction via Deeper 2D and 3D Graph Networks,"Molecular property prediction is gaining increasing attention due to its
diverse applications. One task of particular interests and importance is to
predict quantum chemical properties without 3D equilibrium structures. This is
practically favorable since obtaining 3D equilibrium structures requires
extremely expensive calculations. In this work, we design a deep graph neural
network to predict quantum properties by directly learning from 2D molecular
graphs. In addition, we propose a 3D graph neural network to learn from
low-cost conformer sets, which can be obtained with open-source tools using an
affordable budget. We employ our methods to participate in the 2021 KDD Cup on
OGB Large-Scale Challenge (OGB-LSC), which aims to predict the HOMO-LUMO energy
gap of molecules. Final evaluation results reveal that we are one of the
winners with a mean absolute error of 0.1235 on the holdout test set. Our
implementation is available as part of the MoleculeX package
(https://github.com/divelab/MoleculeX)."
50,Information Obfuscation of Graph Neural Networks,"While the advent of Graph Neural Networks (GNNs) has greatly improved node
and graph representation learning in many applications, the neighborhood
aggregation scheme exposes additional vulnerabilities to adversaries seeking to
extract node-level information about sensitive attributes. In this paper, we
study the problem of protecting sensitive attributes by information obfuscation
when learning with graph structured data. We propose a framework to locally
filter out pre-determined sensitive attributes via adversarial training with
the total variation and the Wasserstein distance. Our method creates a strong
defense against inference attacks, while only suffering small loss in task
performance. Theoretically, we analyze the effectiveness of our framework
against a worst-case adversary, and characterize an inherent trade-off between
maximizing predictive accuracy and minimizing information leakage. Experiments
across multiple datasets from recommender systems, knowledge graphs and quantum
chemistry demonstrate that the proposed approach provides a robust defense
across various graph structures and tasks, while producing competitive GNN
encoders for downstream tasks."
51,A Neural Network Perturbation Theory Based on the Born Series,"Deep Learning using the eponymous deep neural networks (DNNs) has become an
attractive approach towards various data-based problems of theoretical physics
in the past decade. There has been a clear trend to deeper architectures
containing increasingly more powerful and involved layers. Contrarily, Taylor
coefficients of DNNs still appear mainly in the light of interpretability
studies, where they are computed at most to first order. However, especially in
theoretical physics numerous problems benefit from accessing higher orders, as
well. This gap motivates a general formulation of neural network (NN) Taylor
expansions. Restricting our analysis to multilayer perceptrons (MLPs) and
introducing quantities we refer to as propagators and vertices, both depending
on the MLP's weights and biases, we establish a graph-theoretical approach.
Similarly to Feynman rules in quantum field theories, we can systematically
assign diagrams containing propagators and vertices to the corresponding
partial derivative. Examining this approach for S-wave scattering lengths of
shallow potentials, we observe NNs to adapt their derivatives mainly to the
leading order of the target function's Taylor expansion. To circumvent this
problem, we propose an iterative NN perturbation theory. During each iteration
we eliminate the leading order, such that the next-to-leading order can be
faithfully learned during the subsequent iteration. After performing two
iterations, we find that the first- and second-order Born terms are correctly
adapted during the respective iterations. Finally, we combine both results to
find a proxy that acts as a machine-learned second-order Born approximation."
52,Single-Photon Image Classification,"Quantum computing-based machine learning mainly focuses on quantum computing
hardware that is experimentally challenging to realize due to requiring quantum
gates that operate at very low temperature. Instead, we demonstrate the
existence of a lower performance and much lower effort island on the
accuracy-vs-qubits graph that may well be experimentally accessible with room
temperature optics. This high temperature ""quantum computing toy model"" is
nevertheless interesting to study as it allows rather accessible explanations
of key concepts in quantum computing, in particular interference, entanglement,
and the measurement process.
  We specifically study the problem of classifying an example from the MNIST
and Fashion-MNIST datasets, subject to the constraint that we have to make a
prediction after the detection of the very first photon that passed a
coherently illuminated filter showing the example. Whereas a classical set-up
in which a photon is detected after falling on one of the $28\times 28$ image
pixels is limited to a (maximum likelihood estimation) accuracy of $21.27\%$
for MNIST, respectively $18.27\%$ for Fashion-MNIST, we show that the
theoretically achievable accuracy when exploiting inference by optically
transforming the quantum state of the photon is at least $41.27\%$ for MNIST,
respectively $36.14\%$ for Fashion-MNIST.
  We show in detail how to train the corresponding transformation with
TensorFlow and also explain how this example can serve as a teaching tool for
the measurement process in quantum mechanics."
53,ForceNet: A Graph Neural Network for Large-Scale Quantum Calculations,"With massive amounts of atomic simulation data available, there is a huge
opportunity to develop fast and accurate machine learning models to approximate
expensive physics-based calculations. The key quantity to estimate is atomic
forces, where the state-of-the-art Graph Neural Networks (GNNs) explicitly
enforce basic physical constraints such as rotation-covariance. However, to
strictly satisfy the physical constraints, existing models have to make
tradeoffs between computational efficiency and model expressiveness. Here we
explore an alternative approach. By not imposing explicit physical constraints,
we can flexibly design expressive models while maintaining their computational
efficiency. Physical constraints are implicitly imposed by training the models
using physics-based data augmentation. To evaluate the approach, we carefully
design a scalable and expressive GNN model, ForceNet, and apply it to OC20
(Chanussot et al., 2020), an unprecedentedly-large dataset of quantum physics
calculations. Our proposed ForceNet is able to predict atomic forces more
accurately than state-of-the-art physics-based GNNs while being faster both in
training and inference. Overall, our promising and counter-intuitive results
open up an exciting avenue for future research."
54,Hybrid Quantum-Classical Graph Convolutional Network,"The high energy physics (HEP) community has a long history of dealing with
large-scale datasets. To manage such voluminous data, classical machine
learning and deep learning techniques have been employed to accelerate physics
discovery. Recent advances in quantum machine learning (QML) have indicated the
potential of applying these techniques in HEP. However, there are only limited
results in QML applications currently available. In particular, the challenge
of processing sparse data, common in HEP datasets, has not been extensively
studied in QML models. This research provides a hybrid quantum-classical graph
convolutional network (QGCNN) for learning HEP data. The proposed framework
demonstrates an advantage over classical multilayer perceptron and
convolutional neural networks in the aspect of number of parameters. Moreover,
in terms of testing accuracy, the QGCNN shows comparable performance to a
quantum convolutional neural network on the same HEP dataset while requiring
less than $50\%$ of the parameters. Based on numerical simulation results,
studying the application of graph convolutional operations and other QML models
may prove promising in advancing HEP research and other scientific fields."
55,Bosonic Random Walk Networks for Graph Learning,"The development of Graph Neural Networks (GNNs) has led to great progress in
machine learning on graph-structured data. These networks operate via diffusing
information across the graph nodes while capturing the structure of the graph.
Recently there has also seen tremendous progress in quantum computing
techniques. In this work, we explore applications of multi-particle quantum
walks on diffusing information across graphs. Our model is based on learning
the operators that govern the dynamics of quantum random walkers on graphs. We
demonstrate the effectiveness of our method on classification and regression
tasks."
56,HydroNet: Benchmark Tasks for Preserving Intermolecular Interactions and Structural Motifs in Predictive and Generative Models for Molecular Data,"Intermolecular and long-range interactions are central to phenomena as
diverse as gene regulation, topological states of quantum materials,
electrolyte transport in batteries, and the universal solvation properties of
water. We present a set of challenge problems for preserving intermolecular
interactions and structural motifs in machine-learning approaches to chemical
problems, through the use of a recently published dataset of 4.95 million water
clusters held together by hydrogen bonding interactions and resulting in longer
range structural patterns. The dataset provides spatial coordinates as well as
two types of graph representations, to accommodate a variety of
machine-learning practices."
57,Higher-Order Explanations of Graph Neural Networks via Relevant Walks,"Graph Neural Networks (GNNs) are a popular approach for predicting graph
structured data. As GNNs tightly entangle the input graph into the neural
network structure, common explainable AI approaches are not applicable. To a
large extent, GNNs have remained black-boxes for the user so far. In this
paper, we show that GNNs can in fact be naturally explained using higher-order
expansions, i.e. by identifying groups of edges that jointly contribute to the
prediction. Practically, we find that such explanations can be extracted using
a nested attribution scheme, where existing techniques such as layer-wise
relevance propagation (LRP) can be applied at each step. The output is a
collection of walks into the input graph that are relevant for the prediction.
Our novel explanation method, which we denote by GNN-LRP, is applicable to a
broad range of graph neural networks and lets us extract practically relevant
insights on sentiment analysis of text data, structure-property relationships
in quantum chemistry, and image classification."
58,Gini in a Bottleneck: Sparse Molecular Representations for Graph Convolutional Neural Networks,"Due to the nature of deep learning approaches, it is inherently difficult to
understand which aspects of a molecular graph drive the predictions of the
network. As a mitigation strategy, we constrain certain weights in a multi-task
graph convolutional neural network according to the Gini index to maximize the
""inequality"" of the learned representations. We show that this constraint does
not degrade evaluation metrics for some targets, and allows us to combine the
outputs of the graph convolutional operation in a visually interpretable way.
We then perform a proof-of-concept experiment on quantum chemistry targets on
the public QM9 dataset, and a larger experiment on ADMET targets on proprietary
drug-like molecules. Since a benchmark of explainability in the latter case is
difficult, we informally surveyed medicinal chemists within our organization to
check for agreement between regions of the molecule they and the model
identified as relevant to the properties in question."
