id,title,abstract
78,Convolutional Neural Networks with Transformed Input based on Robust Tensor Network Decomposition,"Tensor network decomposition, originated from quantum physics to model
entangled many-particle quantum systems, turns out to be a promising
mathematical technique to efficiently represent and process big data in
parsimonious manner. In this study, we show that tensor networks can
systematically partition structured data, e.g. color images, for distributed
storage and communication in privacy-preserving manner. Leveraging the sea of
big data and metadata privacy, empirical results show that neighbouring
subtensors with implicit information stored in tensor network formats cannot be
identified for data reconstruction. This technique complements the existing
encryption and randomization techniques which store explicit data
representation at one place and highly susceptible to adversarial attacks such
as side-channel attacks and de-anonymization. Furthermore, we propose a theory
for adversarial examples that mislead convolutional neural networks to
misclassification using subspace analysis based on singular value decomposition
(SVD). The theory is extended to analyze higher-order tensors using
tensor-train SVD (TT-SVD); it helps to explain the level of susceptibility of
different datasets to adversarial attacks, the structural similarity of
different adversarial attacks including global and localized attacks, and the
efficacy of different adversarial defenses based on input transformation. An
efficient and adaptive algorithm based on robust TT-SVD is then developed to
detect strong and static adversarial attacks."
79,SchNet: A continuous-filter convolutional neural network for modeling quantum interactions,"Deep learning has the potential to revolutionize quantum chemistry as it is
ideally suited to learn representations for structured data and speed up the
exploration of chemical space. While convolutional neural networks have proven
to be the first choice for images, audio and video data, the atoms in molecules
are not restricted to a grid. Instead, their precise locations contain
essential physical information, that would get lost if discretized. Thus, we
propose to use continuous-filter convolutional layers to be able to model local
correlations without requiring the data to lie on a grid. We apply those layers
in SchNet: a novel deep learning architecture modeling quantum interactions in
molecules. We obtain a joint model for the total energy and interatomic forces
that follows fundamental quantum-chemical principles. This includes
rotationally invariant energy predictions and a smooth, differentiable
potential energy surface. Our architecture achieves state-of-the-art
performance for benchmarks of equilibrium molecules and molecular dynamics
trajectories. Finally, we introduce a more challenging benchmark with chemical
and structural variations that suggests the path for further work."
80,Optimizing Quantum Variational Circuits with Deep Reinforcement Learning,"Quantum Machine Learning (QML) is considered to be one of the most promising
applications of near term quantum devices. However, the optimization of quantum
machine learning models presents numerous challenges arising from the
imperfections of hardware and the fundamental obstacles in navigating an
exponentially scaling Hilbert space. In this work, we evaluate the potential of
contemporary methods in deep reinforcement learning to augment gradient based
optimization routines in quantum variational circuits. We find that
reinforcement learning augmented optimizers consistently outperform gradient
descent in noisy environments. All code and pretrained weights are available to
replicate the results or deploy the models at
https://github.com/lockwo/rl_qvc_opt."
81,Introduction to Quantum Reinforcement Learning: Theory and PennyLane-based Implementation,"The emergence of quantum computing enables for researchers to apply quantum
circuit on many existing studies. Utilizing quantum circuit and quantum
differential programming, many research are conducted such as \textit{Quantum
Machine Learning} (QML). In particular, quantum reinforcement learning is a
good field to test the possibility of quantum machine learning, and a lot of
research is being done. This work will introduce the concept of quantum
reinforcement learning using a variational quantum circuit, and confirm its
possibility through implementation and experimentation. We will first present
the background knowledge and working principle of quantum reinforcement
learning, and then guide the implementation method using the PennyLane library.
We will also discuss the power and possibility of quantum reinforcement
learning from the experimental results obtained through this work."
82,Deep Reinforcement Learning with Quantum-inspired Experience Replay,"In this paper, a novel training paradigm inspired by quantum computation is
proposed for deep reinforcement learning (DRL) with experience replay. In
contrast to traditional experience replay mechanism in DRL, the proposed deep
reinforcement learning with quantum-inspired experience replay (DRL-QER)
adaptively chooses experiences from the replay buffer according to the
complexity and the replayed times of each experience (also called transition),
to achieve a balance between exploration and exploitation. In DRL-QER,
transitions are first formulated in quantum representations, and then the
preparation operation and the depreciation operation are performed on the
transitions. In this progress, the preparation operation reflects the
relationship between the temporal difference errors (TD-errors) and the
importance of the experiences, while the depreciation operation is taken into
account to ensure the diversity of the transitions. The experimental results on
Atari 2600 games show that DRL-QER outperforms state-of-the-art algorithms such
as DRL-PER and DCRL on most of these games with improved training efficiency,
and is also applicable to such memory-based DRL approaches as double network
and dueling network."
83,On the convergence of projective-simulation-based reinforcement learning in Markov decision processes,"In recent years, the interest in leveraging quantum effects for enhancing
machine learning tasks has significantly increased. Many algorithms speeding up
supervised and unsupervised learning were established. The first framework in
which ways to exploit quantum resources specifically for the broader context of
reinforcement learning were found is projective simulation. Projective
simulation presents an agent-based reinforcement learning approach designed in
a manner which may support quantum walk-based speed-ups. Although classical
variants of projective simulation have been benchmarked against common
reinforcement learning algorithms, very few formal theoretical analyses have
been provided for its performance in standard learning scenarios. In this
paper, we provide a detailed formal discussion of the properties of this model.
Specifically, we prove that one version of the projective simulation model,
understood as a reinforcement learning approach, converges to optimal behavior
in a large class of Markov decision processes. This proof shows that a
physically-inspired approach to reinforcement learning can guarantee to
converge."
84,Variational Quantum Circuits for Deep Reinforcement Learning,"The state-of-the-art machine learning approaches are based on classical von
Neumann computing architectures and have been widely used in many industrial
and academic domains. With the recent development of quantum computing,
researchers and tech-giants have attempted new quantum circuits for machine
learning tasks. However, the existing quantum computing platforms are hard to
simulate classical deep learning models or problems because of the
intractability of deep quantum circuits. Thus, it is necessary to design
feasible quantum algorithms for quantum machine learning for noisy intermediate
scale quantum (NISQ) devices. This work explores variational quantum circuits
for deep reinforcement learning. Specifically, we reshape classical deep
reinforcement learning algorithms like experience replay and target network
into a representation of variational quantum circuits. Moreover, we use a
quantum information encoding scheme to reduce the number of model parameters
compared to classical neural networks. To the best of our knowledge, this work
is the first proof-of-principle demonstration of variational quantum circuits
to approximate the deep $Q$-value function for decision-making and
policy-selection reinforcement learning with experience replay and target
network. Besides, our variational quantum circuits can be deployed in many
near-term NISQ machines."
85,Reinforcement Learning for Molecular Design Guided by Quantum Mechanics,"Automating molecular design using deep reinforcement learning (RL) holds the
promise of accelerating the discovery of new chemical compounds. Existing
approaches work with molecular graphs and thus ignore the location of atoms in
space, which restricts them to 1) generating single organic molecules and 2)
heuristic reward functions. To address this, we present a novel RL formulation
for molecular design in Cartesian coordinates, thereby extending the class of
molecules that can be built. Our reward function is directly based on
fundamental physical properties such as the energy, which we approximate via
fast quantum-chemical methods. To enable progress towards de-novo molecular
design, we introduce MolGym, an RL environment comprising several challenging
molecular design tasks along with baselines. In our experiments, we show that
our agent can efficiently learn to solve these tasks from scratch by working in
a translation and rotation invariant state-action space."
86,Gradient Monitored Reinforcement Learning,"This paper presents a novel neural network training approach for faster
convergence and better generalization abilities in deep reinforcement learning.
Particularly, we focus on the enhancement of training and evaluation
performance in reinforcement learning algorithms by systematically reducing
gradient's variance and thereby providing a more targeted learning process. The
proposed method which we term as Gradient Monitoring(GM), is an approach to
steer the learning in the weight parameters of a neural network based on the
dynamic development and feedback from the training process itself. We propose
different variants of the GM methodology which have been proven to increase the
underlying performance of the model. The one of the proposed variant, Momentum
with Gradient Monitoring (M-WGM), allows for a continuous adjustment of the
quantum of back-propagated gradients in the network based on certain learning
parameters. We further enhance the method with Adaptive Momentum with Gradient
Monitoring (AM-WGM) method which allows for automatic adjustment between
focused learning of certain weights versus a more dispersed learning depending
on the feedback from the rewards collected. As a by-product, it also allows for
automatic derivation of the required deep network sizes during training as the
algorithm automatically freezes trained weights. The approach is applied to two
discrete (Multi-Robot Co-ordination problem and Atari games) and one continuous
control task (MuJoCo) using Advantage Actor-Critic (A2C) and Proximal Policy
Optimization (PPO) respectively. The results obtained particularly underline
the applicability and performance improvements of the methods in terms of
generalization capability."
87,Simultaneously Evolving Deep Reinforcement Learning Models using Multifactorial Optimization,"In recent years, Multifactorial Optimization (MFO) has gained a notable
momentum in the research community. MFO is known for its inherent capability to
efficiently address multiple optimization tasks at the same time, while
transferring information among such tasks to improve their convergence speed.
On the other hand, the quantum leap made by Deep Q Learning (DQL) in the
Machine Learning field has allowed facing Reinforcement Learning (RL) problems
of unprecedented complexity. Unfortunately, complex DQL models usually find it
difficult to converge to optimal policies due to the lack of exploration or
sparse rewards. In order to overcome these drawbacks, pre-trained models are
widely harnessed via Transfer Learning, extrapolating knowledge acquired in a
source task to the target task. Besides, meta-heuristic optimization has been
shown to reduce the lack of exploration of DQL models. This work proposes a MFO
framework capable of simultaneously evolving several DQL models towards solving
interrelated RL tasks. Specifically, our proposed framework blends together the
benefits of meta-heuristic optimization, Transfer Learning and DQL to automate
the process of knowledge transfer and policy learning of distributed RL agents.
A thorough experimentation is presented and discussed so as to assess the
performance of the framework, its comparison to the traditional methodology for
Transfer Learning in terms of convergence, speed and policy quality , and the
intertask relationships found and exploited over the search process."
88,Reinforcement Learning Enhanced Quantum-inspired Algorithm for Combinatorial Optimization,"Quantum hardware and quantum-inspired algorithms are becoming increasingly
popular for combinatorial optimization. However, these algorithms may require
careful hyperparameter tuning for each problem instance. We use a reinforcement
learning agent in conjunction with a quantum-inspired algorithm to solve the
Ising energy minimization problem, which is equivalent to the Maximum Cut
problem. The agent controls the algorithm by tuning one of its parameters with
the goal of improving recently seen solutions. We propose a new Rescaled Ranked
Reward (R3) method that enables stable single-player version of self-play
training that helps the agent to escape local optima. The training on any
problem instance can be accelerated by applying transfer learning from an agent
trained on randomly generated problems. Our approach allows sampling
high-quality solutions to the Ising problem with high probability and
outperforms both baseline heuristics and a black-box hyperparameter
optimization approach."
89,Hamiltonian Generative Networks,"The Hamiltonian formalism plays a central role in classical and quantum
physics. Hamiltonians are the main tool for modelling the continuous time
evolution of systems with conserved quantities, and they come equipped with
many useful properties, like time reversibility and smooth interpolation in
time. These properties are important for many machine learning problems - from
sequence prediction to reinforcement learning and density modelling - but are
not typically provided out of the box by standard tools such as recurrent
neural networks. In this paper, we introduce the Hamiltonian Generative Network
(HGN), the first approach capable of consistently learning Hamiltonian dynamics
from high-dimensional observations (such as images) without restrictive domain
assumptions. Once trained, we can use HGN to sample new trajectories, perform
rollouts both forward and backward in time and even speed up or slow down the
learned dynamics. We demonstrate how a simple modification of the network
architecture turns HGN into a powerful normalising flow model, called Neural
Hamiltonian Flow (NHF), that uses Hamiltonian dynamics to model expressive
densities. We hope that our work serves as a first practical demonstration of
the value that the Hamiltonian formalism can bring to deep learning."
90,Learning to Optimize Variational Quantum Circuits to Solve Combinatorial Problems,"Quantum computing is a computational paradigm with the potential to
outperform classical methods for a variety of problems. Proposed recently, the
Quantum Approximate Optimization Algorithm (QAOA) is considered as one of the
leading candidates for demonstrating quantum advantage in the near term. QAOA
is a variational hybrid quantum-classical algorithm for approximately solving
combinatorial optimization problems. The quality of the solution obtained by
QAOA for a given problem instance depends on the performance of the classical
optimizer used to optimize the variational parameters. In this paper, we
formulate the problem of finding optimal QAOA parameters as a learning task in
which the knowledge gained from solving training instances can be leveraged to
find high-quality solutions for unseen test instances. To this end, we develop
two machine-learning-based approaches. Our first approach adopts a
reinforcement learning (RL) framework to learn a policy network to optimize
QAOA circuits. Our second approach adopts a kernel density estimation (KDE)
technique to learn a generative model of optimal QAOA parameters. In both
approaches, the training procedure is performed on small-sized problem
instances that can be simulated on a classical computer; yet the learned RL
policy and the generative model can be used to efficiently solve larger
problems. Extensive simulations using the IBM Qiskit Aer quantum circuit
simulator demonstrate that our proposed RL- and KDE-based approaches reduce the
optimality gap by factors up to 30.15 when compared with other commonly used
off-the-shelf optimizers."
91,Reinforcement-Learning-Based Variational Quantum Circuits Optimization for Combinatorial Problems,"Quantum computing exploits basic quantum phenomena such as state
superposition and entanglement to perform computations. The Quantum Approximate
Optimization Algorithm (QAOA) is arguably one of the leading quantum algorithms
that can outperform classical state-of-the-art methods in the near term. QAOA
is a hybrid quantum-classical algorithm that combines a parameterized quantum
state evolution with a classical optimization routine to approximately solve
combinatorial problems. The quality of the solution obtained by QAOA within a
fixed budget of calls to the quantum computer depends on the performance of the
classical optimization routine used to optimize the variational parameters. In
this work, we propose an approach based on reinforcement learning (RL) to train
a policy network that can be used to quickly find high-quality variational
parameters for unseen combinatorial problem instances. The RL agent is trained
on small problem instances which can be simulated on a classical computer, yet
the learned RL policy is generalizable and can be used to efficiently solve
larger instances. Extensive simulations using the IBM Qiskit Aer quantum
circuit simulator demonstrate that our trained RL policy can reduce the
optimality gap by a factor up to 8.61 compared with other off-the-shelf
optimizers tested."
92,Fidelity-based Probabilistic Q-learning for Control of Quantum Systems,"The balance between exploration and exploitation is a key problem for
reinforcement learning methods, especially for Q-learning. In this paper, a
fidelity-based probabilistic Q-learning (FPQL) approach is presented to
naturally solve this problem and applied for learning control of quantum
systems. In this approach, fidelity is adopted to help direct the learning
process and the probability of each action to be selected at a certain state is
updated iteratively along with the learning process, which leads to a natural
exploration strategy instead of a pointed one with configured parameters. A
probabilistic Q-learning (PQL) algorithm is first presented to demonstrate the
basic idea of probabilistic action selection. Then the FPQL algorithm is
presented for learning control of quantum systems. Two examples (a spin- 1/2
system and a lamda-type atomic system) are demonstrated to test the performance
of the FPQL algorithm. The results show that FPQL algorithms attain a better
balance between exploration and exploitation, and can also avoid local optimal
policies and accelerate the learning process."
93,Benchmarking projective simulation in navigation problems,"Projective simulation (PS) is a model for intelligent agents with a
deliberation capacity that is based on episodic memory. The model has been
shown to provide a flexible framework for constructing reinforcement-learning
agents, and it allows for quantum mechanical generalization, which leads to a
speed-up in deliberation time. PS agents have been applied successfully in the
context of complex skill learning in robotics, and in the design of
state-of-the-art quantum experiments. In this paper, we study the performance
of projective simulation in two benchmarking problems in navigation, namely the
grid world and the mountain car problem. The performance of PS is compared to
standard tabular reinforcement learning approaches, Q-learning and SARSA. Our
comparison demonstrates that the performance of PS and standard learning
approaches are qualitatively and quantitatively similar, while it is much
easier to choose optimal model parameters in case of projective simulation,
with a reduced computational effort of one to two orders of magnitude. Our
results show that the projective simulation model stands out for its simplicity
in terms of the number of model parameters, which makes it simple to set up the
learning agent in unknown task environments."
94,Taking gradients through experiments: LSTMs and memory proximal policy optimization for black-box quantum control,"In this work we introduce the application of black-box quantum control as an
interesting rein- forcement learning problem to the machine learning community.
We analyze the structure of the reinforcement learning problems arising in
quantum physics and argue that agents parameterized by long short-term memory
(LSTM) networks trained via stochastic policy gradients yield a general method
to solving them. In this context we introduce a variant of the proximal policy
optimization (PPO) algorithm called the memory proximal policy optimization
(MPPO) which is based on this analysis. We then show how it can be applied to
specific learning tasks and present results of nu- merical experiments showing
that our method achieves state-of-the-art results for several learning tasks in
quantum control with discrete and continouous control parameters."
95,Free energy-based reinforcement learning using a quantum processor,"Recent theoretical and experimental results suggest the possibility of using
current and near-future quantum hardware in challenging sampling tasks. In this
paper, we introduce free energy-based reinforcement learning (FERL) as an
application of quantum hardware. We propose a method for processing a quantum
annealer's measured qubit spin configurations in approximating the free energy
of a quantum Boltzmann machine (QBM). We then apply this method to perform
reinforcement learning on the grid-world problem using the D-Wave 2000Q quantum
annealer. The experimental results show that our technique is a promising
method for harnessing the power of quantum sampling in reinforcement learning
tasks."
96,Learning in Quantum Control: High-Dimensional Global Optimization for Noisy Quantum Dynamics,"Quantum control is valuable for various quantum technologies such as
high-fidelity gates for universal quantum computing, adaptive quantum-enhanced
metrology, and ultra-cold atom manipulation. Although supervised machine
learning and reinforcement learning are widely used for optimizing control
parameters in classical systems, quantum control for parameter optimization is
mainly pursued via gradient-based greedy algorithms. Although the quantum
fitness landscape is often compatible with greedy algorithms, sometimes greedy
algorithms yield poor results, especially for large-dimensional quantum
systems. We employ differential evolution algorithms to circumvent the
stagnation problem of non-convex optimization. We improve quantum control
fidelity for noisy system by averaging over the objective function. To reduce
computational cost, we introduce heuristics for early termination of runs and
for adaptive selection of search subspaces. Our implementation is massively
parallel and vectorized to reduce run time even further. We demonstrate our
methods with two examples, namely quantum phase estimation and quantum gate
design, for which we achieve superior fidelity and scalability than obtained
using greedy algorithms."
97,Rotationally Equivariant Neural Operators for Learning Transformations on Tensor Fields (eg 3D Images and Vector Fields),"We introduce equivariant neural operators for learning resolution invariant
as well as translation and rotation equivariant transformations between sets of
tensor fields. Input and output may contain arbitrary mixes of scalar fields,
vector fields, second order tensor fields and higher order fields. Our tensor
field convolution layers emulate any linear operator by learning its impulse
response or Green's function as the convolution kernel. Our tensor field
attention layers emulate pairwise field coupling via local tensor products.
Convolutions and associated adjoints can be in real or Fourier space allowing
for linear scaling. By unifying concepts from E3NN, TBNN and FNO, we achieve
good predictive performance on a wide range of PDEs and dynamical systems in
engineering and quantum chemistry. Code is in Julia and available upon request
from authors."
