id,title,abstract
98,QuantumFed: A Federated Learning Framework for Collaborative Quantum Training,"With the fast development of quantum computing and deep learning, quantum
neural networks have attracted great attention recently. By leveraging the
power of quantum computing, deep neural networks can potentially overcome
computational power limitations in classic machine learning. However, when
multiple quantum machines wish to train a global model using the local data on
each machine, it may be very difficult to copy the data into one machine and
train the model. Therefore, a collaborative quantum neural network framework is
necessary. In this article, we borrow the core idea of federated learning to
propose QuantumFed, a quantum federated learning framework to have multiple
quantum nodes with local quantum data train a mode together. Our experiments
show the feasibility and robustness of our framework."
99,Interpreting Criminal Charge Prediction and Its Algorithmic Bias via Quantum-Inspired Complex Valued Networks,"While predictive policing has become increasingly common in assisting with
decisions in the criminal justice system, the use of these results is still
controversial. Some software based on deep learning lacks accuracy (e.g., in
F-1), and importantly many decision processes are not transparent, causing
doubt about decision bias, such as perceived racial and age disparities. This
paper addresses bias issues with post-hoc explanations to provide a trustable
prediction of whether a person will receive future criminal charges given one's
previous criminal records by learning temporal behavior patterns over twenty
years. Bi-LSTM relieves the vanishing gradient problem, attentional mechanisms
allow learning and interpretation of feature importance, and complex-valued
networks inspired quantum physics to facilitate a certain level of transparency
in modeling the decision process. Our approach shows a consistent and reliable
prediction precision and recall on a real-life dataset. Our analysis of the
importance of each input feature shows the critical causal impact on
decision-making, suggesting that criminal histories are statistically
significant factors, while identifiers, such as race and age, are not. Finally,
our algorithm indicates that a suspect tends to rather than suddenly increase
crime severity level over time gradually."
100,Geometry-aware Transformer for molecular property prediction,"Recently, graph neural networks (GNNs) have achieved remarkable performances
for quantum mechanical problems. However, a graph convolution can only cover a
localized region, and cannot capture long-range interactions of atoms. This
behavior is contrary to theoretical interatomic potentials, which is a
fundamental limitation of the spatial based GNNs. In this work, we propose a
novel attention-based framework for molecular property prediction tasks. We
represent a molecular conformation as a discrete atomic sequence combined by
atom-atom distance attributes, named Geometry-aware Transformer (GeoT). In
particular, we adopt a Transformer architecture, which has been widely used for
sequential data. Our proposed model trains sequential representations of
molecular graphs based on globally constructed attentions, maintaining all
spatial arrangements of atom pairs. Our method does not suffer from cost
intensive computations, such as angle calculations. The experimental results on
several public benchmarks and visualization maps verified that keeping the
long-range interatomic attributes can significantly improve the model
predictability."
101,Do Large Scale Molecular Language Representations Capture Important Structural Information?,"Predicting chemical properties from the structure of a molecule is of great
importance in many applications including drug discovery and material design.
Machine learning based molecular property prediction holds the promise of
enabling accurate predictions at much less complexity, when compared to, for
example Density Functional Theory (DFT) calculations. Features extracted from
molecular graphs, using graph neural nets in a supervised manner, have emerged
as strong baselines for such tasks. However, the vast chemical space together
with the limited availability of labels makes supervised learning challenging,
calling for learning a general-purpose molecular representation. Recently,
pre-trained transformer-based language models (PTLMs) on large unlabeled corpus
have produced state-of-the-art results in many downstream natural language
processing tasks. Inspired by this development, here we present molecular
embeddings obtained by training an efficient transformer encoder model,
referred to as MoLFormer. This model was employed with a linear attention
mechanism and highly paralleized training on 1D SMILES sequences of 1.1 billion
unlabeled molecules from the PubChem and ZINC datasets. Experiments show that
the learned molecular representation performs competitively, when compared to
existing graph-based and fingerprint-based supervised learning baselines, on
the challenging tasks of predicting properties of QM8 and QM9 molecules.
Further task-specific fine-tuning of the MoLFormerr representation improves
performance on several of those property prediction benchmarks. These results
provide encouraging evidence that large-scale molecular language models can
capture sufficient structural information to be able to accurately predict
quantum chemical properties and beyond."
102,Fast Quantum Property Prediction via Deeper 2D and 3D Graph Networks,"Molecular property prediction is gaining increasing attention due to its
diverse applications. One task of particular interests and importance is to
predict quantum chemical properties without 3D equilibrium structures. This is
practically favorable since obtaining 3D equilibrium structures requires
extremely expensive calculations. In this work, we design a deep graph neural
network to predict quantum properties by directly learning from 2D molecular
graphs. In addition, we propose a 3D graph neural network to learn from
low-cost conformer sets, which can be obtained with open-source tools using an
affordable budget. We employ our methods to participate in the 2021 KDD Cup on
OGB Large-Scale Challenge (OGB-LSC), which aims to predict the HOMO-LUMO energy
gap of molecules. Final evaluation results reveal that we are one of the
winners with a mean absolute error of 0.1235 on the holdout test set. Our
implementation is available as part of the MoleculeX package
(https://github.com/divelab/MoleculeX)."
103,Nonseparable Symplectic Neural Networks,"Predicting the behaviors of Hamiltonian systems has been drawing increasing
attention in scientific machine learning. However, the vast majority of the
literature was focused on predicting separable Hamiltonian systems with their
kinematic and potential energy terms being explicitly decoupled while building
data-driven paradigms to predict nonseparable Hamiltonian systems that are
ubiquitous in fluid dynamics and quantum mechanics were rarely explored. The
main computational challenge lies in the effective embedding of symplectic
priors to describe the inherently coupled evolution of position and momentum,
which typically exhibits intricate dynamics. To solve the problem, we propose a
novel neural network architecture, Nonseparable Symplectic Neural Networks
(NSSNNs), to uncover and embed the symplectic structure of a nonseparable
Hamiltonian system from limited observation data. The enabling mechanics of our
approach is an augmented symplectic time integrator to decouple the position
and momentum energy terms and facilitate their evolution. We demonstrated the
efficacy and versatility of our method by predicting a wide range of
Hamiltonian systems, both separable and nonseparable, including chaotic
vortical flows. We showed the unique computational merits of our approach to
yield long-term, accurate, and robust predictions for large-scale Hamiltonian
systems by rigorously enforcing symplectomorphism."
104,Probability-Density-Based Deep Learning Paradigm for the Fuzzy Design of Functional Metastructures,"In quantum mechanics, a norm squared wave function can be interpreted as the
probability density that describes the likelihood of a particle to be measured
in a given position or momentum. This statistical property is at the core of
the fuzzy structure of microcosmos. Recently, hybrid neural structures raised
intense attention, resulting in various intelligent systems with far-reaching
influence. Here, we propose a probability-density-based deep learning paradigm
for the fuzzy design of functional meta-structures. In contrast to other
inverse design methods, our probability-density-based neural network can
efficiently evaluate and accurately capture all plausible meta-structures in a
high-dimensional parameter space. Local maxima in probability density
distribution correspond to the most likely candidates to meet the desired
performances. We verify this universally adaptive approach in but not limited
to acoustics by designing multiple meta-structures for each targeted
transmission spectrum, with experiments unequivocally demonstrating the
effectiveness and generalization of the inverse design."
105,A Quantum-Inspired Probabilistic Model for the Inverse Design of Meta-Structures,"In quantum mechanics, a norm squared wave function can be interpreted as the
probability density that describes the likelihood of a particle to be measured
in a given position or momentum. This statistical property is at the core of
the microcosmos. Meanwhile, machine learning inverse design of materials raised
intensive attention, resulting in various intelligent systems for matter
engineering. Here, inspired by quantum theory, we propose a probabilistic deep
learning paradigm for the inverse design of functional meta-structures. Our
probability-density-based neural network (PDN) can accurately capture all
plausible meta-structures to meet the desired performances. Local maxima in
probability density distribution correspond to the most likely candidates. We
verify this approach by designing multiple meta-structures for each targeted
transmission spectrum to enrich design choices."
106,Attention augmented differentiable forest for tabular data,"Differentiable forest is an ensemble of decision trees with full
differentiability. Its simple tree structure is easy to use and explain. With
full differentiability, it would be trained in the end-to-end learning
framework with gradient-based optimization method. In this paper, we propose
tree attention block(TAB) in the framework of differentiable forest. TAB block
has two operations, squeeze and regulate. The squeeze operation would extract
the characteristic of each tree. The regulate operation would learn nonlinear
relations between these trees. So TAB block would learn the importance of each
tree and adjust its weight to improve accuracy. Our experiment on large tabular
dataset shows attention augmented differentiable forest would get comparable
accuracy with gradient boosted decision trees(GBDT), which is the
state-of-the-art algorithm for tabular datasets. And on some datasets, our
model has higher accuracy than best GBDT libs (LightGBM, Catboost, and
XGBoost). Differentiable forest model supports batch training and batch size is
much smaller than the size of training set. So on larger data sets, its memory
usage is much lower than GBDT model. The source codes are available at
https://github.com/closest-git/QuantumForest."
107,Heterogeneous Molecular Graph Neural Networks for Predicting Molecule Properties,"As they carry great potential for modeling complex interactions, graph neural
network (GNN)-based methods have been widely used to predict quantum mechanical
properties of molecules. Most of the existing methods treat molecules as
molecular graphs in which atoms are modeled as nodes. They characterize each
atom's chemical environment by modeling its pairwise interactions with other
atoms in the molecule. Although these methods achieve a great success, limited
amount of works explicitly take many-body interactions, i.e., interactions
between three and more atoms, into consideration. In this paper, we introduce a
novel graph representation of molecules, heterogeneous molecular graph (HMG) in
which nodes and edges are of various types, to model many-body interactions.
HMGs have the potential to carry complex geometric information. To leverage the
rich information stored in HMGs for chemical prediction problems, we build
heterogeneous molecular graph neural networks (HMGNN) on the basis of a neural
message passing scheme. HMGNN incorporates global molecule representations and
an attention mechanism into the prediction process. The predictions of HMGNN
are invariant to translation and rotation of atom coordinates, and permutation
of atom indices. Our model achieves state-of-the-art performance in 9 out of 12
tasks on the QM9 dataset."
108,Scalar Coupling Constant Prediction Using Graph Embedding Local Attention Encoder,"Scalar coupling constant (SCC) plays a key role in the analysis of
three-dimensional structure of organic matter, however, the traditional SCC
prediction using quantum mechanical calculations is very time-consuming. To
calculate SCC efficiently and accurately, we proposed a graph embedding local
self-attention encoder (GELAE) model, in which, a novel invariant structure
representation of the coupling system in terms of bond length, bond angle and
dihedral angle was presented firstly, and then a local self-attention module
embedded with the adjacent matrix of a graph was designed to extract
effectively the features of coupling systems, finally, with a modified
classification loss function, the SCC was predicted. To validate the
superiority of the proposed method, we conducted a series of comparison
experiments using different structure representations, different attention
modules, and different losses. The experimental results demonstrate that,
compared to the traditional chemical bond structure representations, the
rotation and translation invariant structure representations proposed in this
work can improve the SCC prediction accuracy; with the graph embedded local
self-attention, the mean absolute error (MAE) of the prediction model in the
validation set decreases from 0.1603 Hz to 0.1067 Hz; using the classification
based loss function instead of the scaled regression loss, the MAE of the
predicted SCC can be decreased to 0.0963 HZ, which is close to the quantum
chemistry standard on CHAMPS dataset."
109,Ising-based Consensus Clustering on Specialized Hardware,"The emergence of specialized optimization hardware such as CMOS annealers and
adiabatic quantum computers carries the promise of solving hard combinatorial
optimization problems more efficiently in hardware. Recent work has focused on
formulating different combinatorial optimization problems as Ising models, the
core mathematical abstraction used by a large number of these hardware
platforms, and evaluating the performance of these models when solved on
specialized hardware. An interesting area of application is data mining, where
combinatorial optimization problems underlie many core tasks. In this work, we
focus on consensus clustering (clustering aggregation), an important
combinatorial problem that has received much attention over the last two
decades. We present two Ising models for consensus clustering and evaluate them
using the Fujitsu Digital Annealer, a quantum-inspired CMOS annealer. Our
empirical evaluation shows that our approach outperforms existing techniques
and is a promising direction for future research."
110,Deep differentiable forest with sparse attention for the tabular data,"We present a general architecture of deep differentiable forest and its
sparse attention mechanism. The differentiable forest has the advantages of
both trees and neural networks. Its structure is a simple binary tree, easy to
use and understand. It has full differentiability and all variables are
learnable parameters. We would train it by the gradient-based optimization
method, which shows great power in the training of deep CNN. We find and
analyze the attention mechanism in the differentiable forest. That is, each
decision depends on only a few important features, and others are irrelevant.
The attention is always sparse. Based on this observation, we improve its
sparsity by data-aware initialization. We use the attribute importance to
initialize the attention weight. Then the learned weight is much sparse than
that from random initialization. Our experiment on some large tabular dataset
shows differentiable forest has higher accuracy than GBDT, which is the state
of art algorithm for tabular datasets. The source codes are available at
https://github.com/closest-git/QuantumForest"
111,"Expressive power of tensor-network factorizations for probabilistic modeling, with applications from hidden Markov models to quantum machine learning","Tensor-network techniques have enjoyed outstanding success in physics, and
have recently attracted attention in machine learning, both as a tool for the
formulation of new learning algorithms and for enhancing the mathematical
understanding of existing methods. Inspired by these developments, and the
natural correspondence between tensor networks and probabilistic graphical
models, we provide a rigorous analysis of the expressive power of various
tensor-network factorizations of discrete multivariate probability
distributions. These factorizations include non-negative tensor-trains/MPS,
which are in correspondence with hidden Markov models, and Born machines, which
are naturally related to local quantum circuits. When used to model probability
distributions, they exhibit tractable likelihoods and admit efficient learning
algorithms. Interestingly, we prove that there exist probability distributions
for which there are unbounded separations between the resource requirements of
some of these tensor-network factorizations. Particularly surprising is the
fact that using complex instead of real tensors can lead to an arbitrarily
large reduction in the number of parameters of the network. Additionally, we
introduce locally purified states (LPS), a new factorization inspired by
techniques for the simulation of quantum systems, with provably better
expressive power than all other representations considered. The ramifications
of this result are explored through numerical experiments. Our findings imply
that LPS should be considered over hidden Markov models, and furthermore
provide guidelines for the design of local quantum circuits for probabilistic
modeling."
112,Alchemy: A Quantum Chemistry Dataset for Benchmarking AI Models,"We introduce a new molecular dataset, named Alchemy, for developing machine
learning models useful in chemistry and material science. As of June 20th 2019,
the dataset comprises of 12 quantum mechanical properties of 119,487 organic
molecules with up to 14 heavy atoms, sampled from the GDB MedChem database. The
Alchemy dataset expands the volume and diversity of existing molecular
datasets. Our extensive benchmarks of the state-of-the-art graph neural network
models on Alchemy clearly manifest the usefulness of new data in validating and
developing machine learning models for chemistry and material science. We
further launch a contest to attract attentions from researchers in the related
fields. More details can be found on the contest website
\footnote{https://alchemy.tencent.com}. At the time of benchamrking experiment,
we have generated 119,487 molecules in our Alchemy dataset. More molecular
samples are generated since then. Hence, we provide a list of molecules used in
the reported benchmarks."
113,Path-Augmented Graph Transformer Network,"Much of the recent work on learning molecular representations has been based
on Graph Convolution Networks (GCN). These models rely on local aggregation
operations and can therefore miss higher-order graph properties. To remedy
this, we propose Path-Augmented Graph Transformer Networks (PAGTN) that are
explicitly built on longer-range dependencies in graph-structured data.
Specifically, we use path features in molecular graphs to create global
attention layers. We compare our PAGTN model against the GCN model and show
that our model consistently outperforms GCNs on molecular property prediction
datasets including quantum chemistry (QM7, QM8, QM9), physical chemistry (ESOL,
Lipophilictiy) and biochemistry (BACE, BBBP)."
114,Machine Learning by Unitary Tensor Network of Hierarchical Tree Structure,"The resemblance between the methods used in quantum-many body physics and in
machine learning has drawn considerable attention. In particular, tensor
networks (TNs) and deep learning architectures bear striking similarities to
the extent that TNs can be used for machine learning. Previous results used
one-dimensional TNs in image recognition, showing limited scalability and
flexibilities. In this work, we train two-dimensional hierarchical TNs to solve
image recognition problems, using a training algorithm derived from the
multi-scale entanglement renormalization ansatz. This approach introduces
mathematical connections among quantum many-body physics, quantum information
theory, and machine learning. While keeping the TN unitary in the training
phase, TN states are defined, which encode classes of images into quantum
many-body states. We study the quantum features of the TN states, including
quantum entanglement and fidelity. We find these quantities could be properties
that characterize the image classes, as well as the machine learning tasks."
115,Independent Vector Analysis for Data Fusion Prior to Molecular Property Prediction with Machine Learning,"Due to its high computational speed and accuracy compared to ab-initio
quantum chemistry and forcefield modeling, the prediction of molecular
properties using machine learning has received great attention in the fields of
materials design and drug discovery. A main ingredient required for machine
learning is a training dataset consisting of molecular features\textemdash for
example fingerprint bits, chemical descriptors, etc. that adequately
characterize the corresponding molecules. However, choosing features for any
application is highly non-trivial. No ""universal"" method for feature selection
exists. In this work, we propose a data fusion framework that uses Independent
Vector Analysis to exploit underlying complementary information contained in
different molecular featurization methods, bringing us a step closer to
automated feature generation. Our approach takes an arbitrary number of
individual feature vectors and automatically generates a single, compact (low
dimensional) set of molecular features that can be used to enhance the
prediction performance of regression models. At the same time our methodology
retains the possibility of interpreting the generated features to discover
relationships between molecular structures and properties. We demonstrate this
on the QM7b dataset for the prediction of several properties such as
atomization energy, polarizability, frontier orbital eigenvalues, ionization
potential, electron affinity, and excitation energies. In addition, we show how
our method helps improve the prediction of experimental binding affinities for
a set of human BACE-1 inhibitors. To encourage more widespread use of IVA we
have developed the PyIVA Python package, an open source code which is available
for download on Github."
116,Attention augmented differentiable forest for tabular data,"Differentiable forest is an ensemble of decision trees with full
differentiability. Its simple tree structure is easy to use and explain. With
full differentiability, it would be trained in the end-to-end learning
framework with gradient-based optimization method. In this paper, we propose
tree attention block(TAB) in the framework of differentiable forest. TAB block
has two operations, squeeze and regulate. The squeeze operation would extract
the characteristic of each tree. The regulate operation would learn nonlinear
relations between these trees. So TAB block would learn the importance of each
tree and adjust its weight to improve accuracy. Our experiment on large tabular
dataset shows attention augmented differentiable forest would get comparable
accuracy with gradient boosted decision trees(GBDT), which is the
state-of-the-art algorithm for tabular datasets. And on some datasets, our
model has higher accuracy than best GBDT libs (LightGBM, Catboost, and
XGBoost). Differentiable forest model supports batch training and batch size is
much smaller than the size of training set. So on larger data sets, its memory
usage is much lower than GBDT model. The source codes are available at
https://github.com/closest-git/QuantumForest."
